{
  "schema_version": "1.0.0",
  "action": "clarify",
  "material_status": "missing",
  "body": "You mentioned a change but have not described what happened afterward.",
  "question": "What did you observe after the change?",
  "question_purpose": "material",
  "source_refs": ["item:11111111-1111-4111-8111-111111111111"],
  "lesson_ref": null,
  "suggested_actions": ["reply", "explain", "finish"]
}
